{
  "$schema": "http://json-schema.org/draft-07/schema#",
  "$id": "https://vlp.invalid/schemas/events/ReleaseRequested.schema.json",
  "title": "ReleaseRequested",
  "description": "고객이 출고를 요청했다(인수 방식). 주소·연락처는 싣지 않는다. (명명: PascalCase, 실행계획서 5장. lifecycle_event와의 통일 여부는 JEFLIX [미결])",
  "type": "object",
  "properties": {
    "eventId": {
      "type": "string",
      "format": "uuid"
    },
    "eventType": {
      "const": "ReleaseRequested"
    },
    "version": {
      "const": 1
    },
    "occurredAt": {
      "type": "string",
      "format": "date-time"
    },
    "contractId": {
      "type": "string",
      "format": "uuid"
    },
    "deliveryId": {
      "oneOf": [
        {
          "type": "string",
          "format": "uuid"
        },
        {
          "type": "null"
        }
      ]
    },
    "actor": {
      "type": "object",
      "properties": {
        "role": {
          "type": "string",
          "enum": [
            "customer",
            "karmaster",
            "shop",
            "admin",
            "system"
          ]
        },
        "userId": {
          "type": "string",
          "minLength": 1
        }
      },
      "required": [
        "role",
        "userId"
      ],
      "additionalProperties": false
    },
    "payload": {
      "type": "object",
      "properties": {
        "receiptMode": {
          "type": "string",
          "enum": [
            "ON_SITE",
            "REMOTE_PROXY"
          ]
        },
        "hasSite": {
          "type": "boolean"
        }
      },
      "required": [
        "receiptMode",
        "hasSite"
      ],
      "additionalProperties": false
    }
  },
  "required": [
    "eventId",
    "eventType",
    "version",
    "occurredAt",
    "contractId",
    "deliveryId",
    "actor",
    "payload"
  ],
  "additionalProperties": false
}